{
  "$schema": "https://json-schema.org/draft/2020-12/schema",
  "$id": "https://justanotherdndgame.local/rpg/character.schema.json",
  "title": "Fiche de personnage",
  "description": "Les CHOIX qui constituent un personnage : espece, classe, historique, valeurs de caracteristique avant augmentation, niveau vise. Rien de DERIVE n'y figure -- ni points de vie, ni classe d'armure, ni valeurs finales : le moteur les calcule (core::buildCharacterSheet, LOT-13), et une valeur ecrite des deux cotes finit par differer d'un cote. Premiere famille de ce dossier a decrire une INSTANCE et non un catalogue : une espece est un modele dont on tire des personnages, un personnage EST une instance.",
  "type": "object",
  "properties": {
    "id": true,
    "name": true,
    "source": true,
    "status": true,
    "asset": true,
    "mecanismesRequis": true,
    "narratif": true,
    "speciesId": {
      "$ref": "https://justanotherdndgame.local/rpg/common.schema.json#/$defs/id",
      "description": "Identifiant d'une espece du catalogue. Un identifiant inconnu s'affiche en tiret plutot qu'en clair : une cle n'est pas une donnee."
    },
    "classId": {
      "$ref": "https://justanotherdndgame.local/rpg/common.schema.json#/$defs/id",
      "description": "Identifiant d'une classe du catalogue."
    },
    "backgroundId": {
      "$ref": "https://justanotherdndgame.local/rpg/common.schema.json#/$defs/id",
      "description": "Identifiant d'un historique du catalogue."
    },
    "level": {
      "type": "integer",
      "minimum": 1,
      "maximum": 20,
      "description": "Niveau du PERSONNAGE (LOT-74), a ne pas confondre avec le niveau-tableau retire au LOT-67."
    },
    "skillProficiencies": {
      "type": "array",
      "items": {
        "$ref": "https://justanotherdndgame.local/rpg/common.schema.json#/$defs/id"
      },
      "uniqueItems": true,
      "description": "Competences maitrisees EN PLUS de celles que l'historique donne : celles-la sont deja dans le catalogue de l'historique, et les repeter ici en ferait une seconde source."
    },
    "languages": {
      "type": "array",
      "items": {
        "$ref": "https://justanotherdndgame.local/rpg/common.schema.json#/$defs/id"
      },
      "uniqueItems": true,
      "description": "Langues CHOISIES (LOT-15, EX-RPG-042) : un historique en accorde un nombre, pas une liste, et la fiche dit lesquelles. Celles de l'espece sont recopiees au chargement ; les repeter ici en ferait une seconde source."
    },
    "baseAbilities": {
      "$ref": "https://justanotherdndgame.local/rpg/common.schema.json#/$defs/abilityScores",
      "description": "Les six valeurs AVANT augmentation d'espece. L'espece les augmente au chargement, dans la limite lue dans rules/character-creation.json."
    },
    "inventory": {
      "type": "object",
      "description": "Ce que le personnage PORTE (LOT-14) : ses seize emplacements d'equipement, son sac et sa bourse. Aucune statistique derivee ici -- ni classe d'armure, ni poids total, ni encombrement : elles se RECALCULENT depuis ce contenu (core::derivedStatsFor), et les ecrire serait une seconde source qui divergerait au premier objet retire.",
      "properties": {
        "equipped": {
          "type": "object",
          "description": "Emplacement -> identifiant de catalogue (arme, armure ou objet). Les noms d'emplacement sont ceux du noyau : head, neck, cloak, torso, belt, hands, ring-left, ring-right, main-hand, off-hand, ranged, ammunition, feet, bracers, pouch, trinket.",
          "additionalProperties": {
            "type": "string",
            "minLength": 1
          }
        },
        "backpack": {
          "type": "array",
          "description": "Le sac, une entree par pile.",
          "items": {
            "type": "object",
            "properties": {
              "itemId": {
                "type": "string",
                "minLength": 1
              },
              "quantity": {
                "type": "integer",
                "minimum": 1
              }
            },
            "required": [
              "itemId"
            ],
            "additionalProperties": false
          }
        },
        "purseCopper": {
          "type": "integer",
          "minimum": 0,
          "description": "Bourse, en pieces de CUIVRE -- la meme unite que les prix du catalogue. La repartition en or, argent et cuivre est une regle d'AFFICHAGE, et vit dans l'ecran."
        }
      },
      "additionalProperties": false
    }
  },
  "required": [
    "id",
    "name",
    "source",
    "speciesId",
    "classId",
    "backgroundId",
    "baseAbilities",
    "level"
  ],
  "additionalProperties": false,
  "allOf": [
    {
      "$ref": "https://justanotherdndgame.local/rpg/common.schema.json#/$defs/entree"
    }
  ]
}
