{
  "id": "demonstration-brenna",
  "name": "Brenna Vaugris",
  "source": "original",
  "status": {
    "provisoire": true,
    "raison": "personnage de DEMONSTRATION du LOT-38 : l'ecran de fiche a besoin d'une fiche a afficher, et il n'y a encore ni groupe (LOT-29) ni sauvegarde (LOT-17) d'ou en tirer une reelle. Sa classe est l'une des quatre classes provisoires du LOT-36, seules disponibles.",
    "retraitSi": "une partie fournit un personnage reel (LOT-29 ou LOT-17) ; ce fichier disparait alors avec les quatre classes provisoires qu'il reference"
  },
  "speciesId": "demi-elfe",
  "classId": "brawler",
  "backgroundId": "cartographer",
  "baseAbilities": {
    "strength": 15,
    "dexterity": 13,
    "constitution": 14,
    "intelligence": 10,
    "wisdom": 12,
    "charisma": 8
  },
  "level": 3,
  "skillProficiencies": [
    "athletics",
    "perception"
  ],
  "inventory": {
    "equipped": {
      "torso": "cuir-cloute",
      "main-hand": "epee-longue",
      "off-hand": "bouclier",
      "neck": "amulette",
      "pouch": "sac-a-dos"
    },
    "backpack": [
      {
        "itemId": "dague",
        "quantity": 1
      },
      {
        "itemId": "torche",
        "quantity": 5
      },
      {
        "itemId": "corde-en-chanvre-15-m",
        "quantity": 1
      },
      {
        "itemId": "rations-1-jour",
        "quantity": 4
      },
      {
        "itemId": "gourde-pleine",
        "quantity": 1
      }
    ],
    "purseCopper": 4275
  }
}
